ID_TRAMIT;NOM_TRAMIT;DESCRIPCIO_TRAMIT;TEMA;CODI_AMBIT;DESCRIPCIO_AMBIT;IMMEDIAT;GRATUIT;REQUISITS;NORMATIVA_APLICABLE;RESPONSABLE;ENLLACOS_RELACIONATS;DATA_CREACIO;PARAULES_CLAU;CANAL_TELEMATIC;CANAL_PRSENCIAL;CANAL_TELEFONIC;CANAL_MOBIL;CANAL_QUIOSC;IDIOMA
***001609;Interrupció o reserva temporal d espais a la via pública;Tall,   interrupció   o  reserva   d¿un   espai   públic   per   un   període   concret,   per  necessitat de obres, descàrregues o càrregues, instal·lació de grues, activitats  professionals, etc. Qui ho pot demanar? El titular de la obra, de l¿activitat o representants legals documentats. Com es pot fer? Presencialment ¿ Prefectura de la Guàrdia Urbana, Oficina d¿atenció al ciutadà Impresos model Cap Documentació que cal aportar Document  de  sol·licitud,  plàno;;0022;seguretat;;N;Documentació que cal aportar Document  de  sol·licitud,  plànol  a  escala  del  tram  de  via  pública  afectada,  assegurança que cobreixi la activitat, documentació i assegurança dels vehicles  utilitzats en l¿activitat. Pagament de la taxa amb targeta de crèdit a la Prefectura a l¿hora de recollir-lo,  o bé Full d autoliquidació de la taxa complimentat per l¿entitat bancària. ;Normativa Llei de Seguretat Vial. Ordenança fiscal numero 15. ;;https://seu.badalona.cat/portalWeb/badalona.portal?_nfpb=true&_pageLabel=detall_tramit&dDocName=***001609#wlp_detall_tramit;06/09/2010;;;S;N;N;;Català 
***016122;Servei de suport a la inserció laboral de persones amb discapacitat (SSIL);ta i dóna suport a processos d inserció laboral de   persones   amb   algun   tipus   de   discapacitat.   La discapacitat pot ser física, orgànica, psíquica, visual, auditiva o una malaltia mental Qui ho pot demanar? Ciutadans i ciutadanes de Badalona en edat laboral i que tinguin el certificat legal de l ICASS amb una discapacitat del 33% o superior. Com es pot fer? Telefònicament ¿ Unitat de Suport i Gestió de Serveis Impresos model  Cap  Documentació que ca;;0024;serveis socials;;N; ; ;;https://seu.badalona.cat/portalWeb/badalona.portal?_nfpb=true&_pageLabel=detall_tramit&dDocName=***016122#wlp_detall_tramit;29/06/2010;;;S;N;N;;Català 
***001612;Servei d assessorament, protecció i seguiment de víctimes acollides al pla judicial de protecció;Servei d assessorament. Servei   de   protecció   i   seguiment   de   víctimes   acollides   al   pla   judicial   de  protecció assignats a Guàrdia Urbana de Badalona. Qui ho pot demanar? La   víctima  a   efectes   de   protecció   i   qualsevol   ciutadà   a   efectes  d¿assessorament. Com es pot fer? Presencialment ¿ Prefectura de la Guàrdia Urbana, Oficina d Atenció al Ciutadà  Impresos model Cap Documentació que cal aportar Docum;;0022;seguretat;;S;Documentació que cal aportar Documentació judicial afecta al cas. ;Normativa ¿ Codi Penal  ¿ Llei d enjudiciament criminal  ;;https://seu.badalona.cat/portalWeb/badalona.portal?_nfpb=true&_pageLabel=detall_tramit&dDocName=***001612#wlp_detall_tramit;30/06/2010;;;S;N;N;;Català 
***016062;Servei de transport adaptat complementari per a persones amb discapacitat;àdic i individual per a persones amb mobilitat  reduïda, que es duu a terme en taxi. Es tracta d¿un servei complementari al transport públic regular no adaptat. Es pot demanar un màxim de 8 viatges al més per persona usuària, sempre i quan hi  hagi disponibilitat del servei. Qui ho pot demanar? Persones   empadronades   a   Badalona   amb   certificat   de   discapacitat   i   barem   de  mobilitat reduïda. Com es pot fer? Presencialment ¿ Oficines Municipals de Districte (OMD).  ¿ Servei d¿Atenció al Ciutadà (SAC) Documentació que cal aportar - Full de sol·licitud del servei que facili;;0024;serveis socials;;N; ; ;;https://seu.badalona.cat/portalWeb/badalona.portal?_nfpb=true&_pageLabel=detall_tramit&dDocName=***016062#wlp_detall_tramit;01/07/2010;;;S;N;N;;Català 
***015308;Informació i orientació sobre temes relacionats amb l escolarització i la formació de l alumnat;Procediment.  L¿object iu   d¿aquesta   act uació   és   informar   i   ori entar   als   ciutadans   que   ho  sol· li ci tin   sobre   qüesti ons   relacionades   amb   l escolari tzaci ó,   i tineraris  format ius,  normati va vigent , etc. Qui ho pot demanar? Tot s els ci ut adans i ci ut adanes Com es pot fer? Es podrà sol·licit ar dia i hora per rebre assessorament  t ècnic. Telefòni cament ¿ Departament  d¿Educaci ó  Correu electrònic ¿ Departament  d¿Educaci ó  Impresos model Documentació que cal apor;;0010;educació;;N;Documentació que cal aportar Segons   sigui   la   informació   sol· li ci tada,   l usuari   podrà   aportar   tota   la  document ació   que   consi deri   adi ent   per   tal   de   poder   tenir   una   respost a   més  ajust ada. ;Normativa ;;https://seu.badalona.cat/portalWeb/badalona.portal?_nfpb=true&_pageLabel=detall_tramit&dDocName=***015308#wlp_detall_tramit;24/08/2010;;;S;N;N;;Català 
***001605;Permís per armes d aire comprimit o elèctriques;Sol·licitud   de  tramitació  de  la   targeta  per  a  ús   i  tinença  d¿armes   de  4a  categoria: - Targeta d¿armes tipus A: Carrabines i pistoles de tir semiautomàtic i de  repetició i revòlvers de doble acció, accionades per aire o gas comprimit  no assimilades a escopetes. - Targeta d¿armes tipus B: Carrabines i pistoles, d¿ànima llisa o ratllada, i  d¿un   sol   tret   i   revòlvers   d¿acció   simple,   accionades   per   aire   o   gas  comprimit no assimilades a escopetes. Qui ho pot demanar? Persones   residents   a   Badalona,   majors   de   16   anys.   Qualsevol   persona  autoritzada. Com es pot fer? Presencialment ¿ Prefectura de la Guàrdia Urbana, Oficina d Atenció al Ciutadà  Impresos model Cap Documentació que cal aportar - Targ;;0022;seguretat;;N;Documentació que cal aportar - Targeta   de   l¿arma,   segellada   per   l¿establiment   venedor,   degudament  emplenada i signada pel titular. - Factura de compra de l¿arma - Una còpia del DNI - Pagament de la taxa. ;Normativa ¿ Reglament general d¿armes i explosius  ¿ Ordenança fiscal numero 13.  ;;https://seu.badalona.cat/portalWeb/badalona.portal?_nfpb=true&_pageLabel=detall_tramit&dDocName=***001605#wlp_detall_tramit;23/08/2010;;;S;N;N;;Català 
***003087;Anàlisi d aigües i aliments;Sol·licitud d¿anàlisi d¿aigües, aigües residuals, aliments i altres Qui ho pot demanar? Qualsevol persona física o jurídica Com es pot fer? Presencialment Es recomana  telefonar  abans al Laboratori (93 483 ** **) o enviar un correu  electrònic  (laboratorimunicipal*************) per concretar el tipus d¿anàlisi, la forma de prendre la  mostra, i com lliurar-la i el termini de remesa ;;0016;medi ambient;;N; ; ;;https://seu.badalona.cat/portalWeb/badalona.portal?_nfpb=true&_pageLabel=detall_tramit&dDocName=***003087#wlp_detall_tramit;05/04/2017;;;S;N;N;;Català 
***001191;Carnet de préstec de llibres;Sol·licitud del carnet que dóna dret a demanar el préstec de llibres a les  biblioteques municipals o a les de la xarxa de la Diputació Qui ho pot demanar? Tothom Com es pot fer? Presencialment ¿ Biblioteques Impresos model Cap Documentació que cal aportar ¿ DNI  ¿ 1 fotografia mida carnet  Normativa Preu Gratuït Organisme responsable Serveis Territorials Observacions </IdcteDocument> ;;;;;S;Documentació que cal aportar ¿ DNI  ¿ 1 fotografia mida carnet  ;Normativa ;;http://www.diba.cat/biblioteques/gestionslinia/solicitarcarnet.asp;24/08/2010;;;N;N;N;;Català 
***016061;Targeta d aparcament per a persones amb discapacitat;arcament   per   a   persones   amb   disminució   i mobilitat   reduïda.   Aquesta   targeta   dóna   dret   a   utilitzar   les   facilitats d estacionament   per   a   persones   amb   disminució   i   mobilitat   reduïda, corresponents   i   vigents   en   qualsevol   lloc   del   país   on   es   trobi   el   titular. Hi   ha   tres   tipus   de   targeta:   Per a les persones amb disminució  i mobilitat reduïda que són conductores. Per a persones amb disminució  i mobilitat  reduïda que no són conductores. Targeta d aparcament per al transport col·lectiu de persones amb disminució i mobilitat reduïda  Qui ho pot demanar? Persones de qualsevol edat que puguin acreditar, mitjançant el Certificat del Servei de Valoració i Orientació, que superen el barem de mobilitat o que tenen una agudesa visual  bilateral  igual  o inferior  a 0,1,  amb correcció,  o una reducció ;;0024;serveis socials;;S; ; ;;https://seu.badalona.cat/portalWeb/badalona.portal?_nfpb=true&_pageLabel=detall_tramit&dDocName=***016061#wlp_detall_tramit;01/07/2010;;;S;N;N;;Català 
***015356;Carnet professor ITIC;Sol·licitud del CARNET DE PROFESSOR INTERNACIONAL (ITIC) És un servei de la International Student Identity Card Association, una organització  sense ànim de lucre associada a la International Student Travel Confederation ISTC.  Amb aquest carnet es pot gaudir d¿avantatges i descomptes arreu del món.  Qui ho pot demanar? Professorat  en actiu adscrit en centres reconeguts oficialment i que acreditin que  treballen a dedicació plena durant l¿any acadèmic vigent. Validesa Curs acadèmic actual (de setembre fins a desembre de l¿any següent). Com es pot fer? Presencialment ¿ Servei d¿Informació Juvenil  Què cal aportar ;;0014;joventut;;N; ;Normativa Enllaç annex Enllaços d¿interès Enllaç annex ;;https://seu.badalona.cat/portalWeb/badalona.portal?_nfpb=true&_pageLabel=detall_tramit&dDocName=***015356#wlp_detall_tramit;20/07/2015;;;S;N;N;;Català 
***015350;Inscripció a activitats atlètiques per escoles;Sol·licitud per inscriure¿s a activitats atlètiques per escoles. Activitat d¿iniciació o aprenentatge a les diferents modalitats de l¿atletisme,  mitjançant sessions dirigides per un tècnic titulat.  Qui ho pot demanar? Qualsevol centre escolar d¿educació infantil, primària, secundària o educació  especial sostingut amb fons públics o privats, en tots els casos a través del  seu representant legal degudament acreditat. Com es pot fer? Presencialment ¿ Esports. Atenc;;0011;esports;;N;Documentació que cal aportar. - Fotocòpia NIF del centre escolar sol·licitant. - Fotocòpia   DNI   del   representant   i   document   que   acrediti   la  representació. - Relació de cursetistes amb data naixement i observacions. ;Normativa i ;;https://seu.badalona.cat/portalWeb/badalona.portal?_nfpb=true&_pageLabel=detall_tramit&dDocName=***015350#wlp_detall_tramit;24/08/2010;;;S;N;N;;Català 
***078340;Cita prèvia amb l enginyer del Dep. de Llicències d¿Activitats, sobre DUBTES TÈCNICS DEL PROJECTE, Sr. David Rodríguez;om es pot fer? En què consisteix el tràmit? Aquest   tràmit   consisteix   en   poder   demanar   una   cita   prèvia   (dia/hora)   per   poder   realitzar  consultes tècniques relatives a tràmits que s¿hagin de sol·licitar o que restin en tràmit, ateses  pel Sr.David Rodríguez Cebrián (enginyer, ref. DRC) del Departament de Llicències  d¿Activitats. Cal tenir en compte el següent: ;;0029;urbanisme;;N; ; ;;http://badalona.cat/appExtSC/citaprevia/solicitudPaso2!ccbs?idServicio=62&idAmbito=2&idDepartamento=82&idTramite=264&idAgenda=262;27/02/2017;;;S;N;N;;Català 
***078338;Cita prèvia sobre DUBTES referents a CANVIS DE TITULAR amb la Sra. Sílvia Canals;om es pot fer? En què consisteix el tràmit? Aquest   tràmit   consisteix   en   poder   demanar   una   cita   prèvia   (dia/hora)   per   poder   realitzar  consultes tècniques relatives a tràmits que s¿hagin de sol·licitar o que restin en tràmit, ateses  per  la  Sra.  Sílvia  Canals  Giró  (canvis  de  titular  i  subrogacions,  ref.  SCG)  del  Departament de Llicències d¿Activit;;0029;urbanisme;;N; ; ;;http://badalona.cat/appExtSC/citaprevia/solicitudPaso2!ccbs?idServicio=62&idAmbito=2&idDepartamento=82&idTramite=262&idAgenda=282;27/02/2017;;;S;N;N;;Català 
***014119;Participació en fira artesanal;r l¿activitat a un dels llocs designats per a  desenvolupar una fira artesanal. Qui ho pot demanar: Tothom major d¿edat. Com es pot fer: Presencialment ¿ Servei d¿Atenció al Ciutadà Mitjançant  instància  signada  per  l¿interessat/ada  i  presentada  al  registre  general. Període de presentació de sol·licituds: Després de la determinaci;;;;;N; ;Normativa aplicable: Ordenança Reguladora de les Fires Artesanals. Documentació que cal aportar: Conforme als requeriments i requisits establerts a l¿Ordenança Reguladora de  les Fires Artesanals.  ;;https://seu.badalona.cat/portalWeb/badalona.portal?_nfpb=true&_pageLabel=detall_tramit&dDocName=***014119#wlp_detall_tramit;24/08/2010;;;S;N;N;;Català 
***001619;Lliurament d un vehicle al dipòsit municipal, per recuperacio procedent de robatori;Lliurament d un vehicle arrossegat per la grua municipal per recuperació com  a producte de robatori. Qui ho pot demanar? Qui   consti   com   a   titular   del   vehicle,   el   conductor   habitual   autoritzat   pel  propietari, o el seu representant legal documentat. Com es pot fer? Presencialment Inicialment ¿ Prefectura de Guàrdia Urbana Posteriorment ¿ Dipòsit Mu;;0022;seguretat;;S;Documentació que cal aportar Documentació acreditativa de la propietat del  vehicle, permís de conduir (si  l¿estat del vehicle el permet circular) DNI, copia de la denuncia interposada  per robatori, copia de l¿aixecament de la denuncia per recuperació, i ordre de  lliurament en cas d¿actuació provinent de Mossos d¿Esquadra. ;Normativa ¿ Llei de enjudiciament criminal  ¿ Codi penal  ;;https://seu.badalona.cat/portalWeb/badalona.portal?_nfpb=true&_pageLabel=detall_tramit&dDocName=***001619#wlp_detall_tramit;29/06/2010;;;S;N;N;;Català 
***015381;Accés provisió lloc de treball per mobilitat interadministrativa;Sol·licitar l¿admissió a la convocatòria per proveir llocs de treball per mobilitat  interadministrativa. Qui ho pot demanar? Personal funcionari de carrera o laboral indefinit fix amb plaça en una altra  Administració pública. Com es pot fer? Presencialment ¿ Departament de RRHH ¿ Servei d Atenció al Ciutadà (SAC)  Per correu administratiu  Qualsevol oficina de correus  Im;;;;;S;Documentació que cal aportar Instància i documentació requerida en cada procés.  ;Normativa general  ¿ Llei 7/2007, de 12 d¿abril de l¿Estatut Bàsic de l¿Empleat Públic ¿ DL 2/2003, de 28 d¿abril que aprova el TR de la Llei Municipal i de  Règim Local de Catalunya. ¿ Decret legislatiu 1/1997, de 31 d¿octubre, text únic dels preceptes de  determinats  textos  legals  vigents  a  Catalunya  en  matèria  de  funció  pública. ¿ Decret  214/1990,  de  30  de  juliol,  amb  el  reglament  del  personal  al  servei de les entitats locals. ;;https://seu.badalona.cat/portalWeb/badalona.portal?_nfpb=true&_pageLabel=detall_tramit&dDocName=***015381#wlp_detall_tramit;15/06/2010;;;S;N;N;;Català 
***014240;Preinscripció de l alumnat als centres educatius en els ensenyaments sufragats amb fons públics d idiomes;Sol· li ci tud d¿una  plaça escolar per a la formaci ó reglada d¿i diomes Les escoles oficials d¿idiomes (EOI) són centres públics no universitaris que imparteixen els  ni vells bàsi c, i nt ermedi i avançat  de diversos idiomes moderns.  Procediment.  L establert   en   la   normat iva   vigent   emesa   pel   Depart ament   d Educaci ó   de   la  Generali tat de Cat alunya, Qui ho pot demanar? L¿alumne   si   és   major   d¿edat   o   be   el   pare,   mare   o   t utors   legals   de   l¿alumne,  en el cas que  sigui menor d¿edat .  Per accedir  als ensenyament s d¿i diomes de  les  EOI  cal  t eni r  com  a  míni m  16  anys  complert s ;;0010;educació;;N;Documentació que cal aportar La       document aci ó       es presentarà en el moment  d¿efect uar la mat rícula:   Original i fot ocopia del DNI,  NIE o passaport.   Original  i  fot ocopia  del  carnet  de  famíli a  nombrosa  o  monoparental,  si  és  el  cas.   Certi fi cat   del   centre   d¿est udi s   (només   les   persones   més   grans   de   14   anys  que  vulgui n est udiar un i di oma di ferent  del que est udien a l ESO).   ; ;;https://seu.badalona.cat/portalWeb/badalona.portal?_nfpb=true&_pageLabel=detall_tramit&dDocName=***014240#wlp_detall_tramit;25/06/2010;;;S;N;N;;Català 
***014239;Preinscripció de l alumnat als centres educatius en els ensenyaments sufragats amb fons públics d ensenyament superior de disseny;Sol· li ci tud   d¿una   plaça   escolar,   en   un   cent re   públi c     en   el   nivell   d¿est udi s  superiors de di sseny Procediment. L establert   en   la   normat iva   vigent   emesa   pel   Depart ament   d Educaci ó   de   la  Generali tat de Cat alunya, En   una   úni ca   sol·licit ud   s¿hi   poden   indicar   peti ci ons   d¿admi ssi ó   en   di versos  centres. Qui ho pot demanar? L¿alumne  si  és major  d¿edat  o be  el  pare,  mare  o t utors legals de  l¿alumne,  en  el cas que sigui  menor d¿edat .  Per accedir a aquest s ensenyament s cal teni r el t ít ol de bat xi ller o equivalent  i   superar   la   prova   d¿accés.  ;;0010;educació;;N;Documentació que cal aportar Els   cent res   que   i mparteixen   aquest s   ensenyament s   us   i nformen   de   la  document ació que heu de present ar ; ;;https://seu.badalona.cat/portalWeb/badalona.portal?_nfpb=true&_pageLabel=detall_tramit&dDocName=***014239#wlp_detall_tramit;25/06/2010;;;S;N;N;;Català 
***014243;Preinscripció de l alumnat als centres educatius en els ensenyaments sufragats amb fons públics de música (ensenyaments no reglats);Sol· li ci tud d¿una  plaça escolar per a cursar est udi s no reglat s de músi ca. Procediment.  A   l Escola   de   Músi ca   es   cursen   est udi s   de   Grau   Elemental   i   nivell  Professi onal   no   reglats.   Al   fi nali tzar   i   superar   aquest s   est udi s   s¿obt é   un  Diploma expedi t pel cent re. Els   ensenyament s   que   s¿i mparteixen   i   est an   di st ri buït s   en   dues   et apes:  Iniciació  i  Elemental.  Es   pot   accedir   sense   conei xement s   de   músi ca   a   la  pri mera   et apa   d¿i ni ci ació   i   mit jançant   una   prova   de   ni vell   a   l¿etapa  d¿Element al Qui ho pot demanar? El   pare,   la   mare   o   els   tutors   legals   de   l¿alumne   que   no   pot   ser   menor   de5  anys.     Per cursar l¿etapa element al cal passar una prova de nivell.   Per   cursar   Ni vell   Professional   cal   haver   superat   la   pr;;0010;educació;;N; ; ;;https://seu.badalona.cat/portalWeb/badalona.portal?_nfpb=true&_pageLabel=detall_tramit&dDocName=***014243#wlp_detall_tramit;08/07/2010;;;S;N;N;;Català 
***014235;Preinscripció de l alumnat als centres educatius en els ensenyaments sufragats amb fons públics de Formació professional de grau mitjà;So l· licit u d   d ¿un a   p la ça   esco la r,   e n   u n   cen t re   pú b lic   o   p riva t   co n ce rt a t,   p e r  cu rsa r  e stu d is de  fo rma ció  p ro f e ssion a l de  g ra u  mit jà. Procediment. L e sta b le rt  en  la  n o rmat iva  vige n t  e me sa  p e l  De pa rt a me nt  d  E d u ca ció  de  la  Ge ne ra lit a t  de  Ca t a lu n ya. Qui ho pot demanar? L ¿a lu mn e  si  é s  ma jo r  d ¿ed a t  o  be  e l  p a re ,  ma re  o  t ut o rs  le g a ls  d e  l¿a lu mn e ,  en  e l  ca s  qu e  sig u i  me n o r  d ¿e da t .  Ca l  q ue  l¿a lu mne  e st ig u i  en  po sse ssió  d el  Tít o l   d e   g ra d ua t   e n   ed uca ció   se cu nd à ria   o b;;0010;educació;;N; ; ;;https://seu.badalona.cat/portalWeb/badalona.portal?_nfpb=true&_pageLabel=detall_tramit&dDocName=***014235#wlp_detall_tramit;11/03/2015;;;S;N;N;;Català 
***001200;Activitats per a dones;Assessorament i informació general en l¿àmbit de la dona.  Coordinació i suport a la xarxa associativa local i nacional i activitats  continuades en temes de sensibilització, promoció i divulgació. Qui ho pot demanar? Tothom Com es pot fer? Presencialment ¿ Oficina d Atenció a la Dona Correu electrònic ¿ Oficina d Atenció a la Dona Impresos model Cap Documentació que cal aportar Normativa Preu Gratuït Organisme responsable Atenció a la Dona Observacions </IdcteDoc;;;;;S;Documentació que cal aportar ;Normativa ;;https://seu.badalona.cat/portalWeb/badalona.portal?_nfpb=true&_pageLabel=detall_tramit&dDocName=***001200#wlp_detall_tramit;31/08/2010;;;S;N;N;;Català 
***001697;Al·legació al tràmit d audiència d un expedient de disciplina d activitats;Al·legació al tràmit d¿audiència d¿un expedient de disciplina d¿activitats. Qui ho pot demanar? Qualsevol persona física o jurídica que sigui part interessada a l¿expedient. Com es pot fer? Presencialment ¿ Oficina d Informació Urbanística ¿ Servei d Atenció al Ciutadà (SAC)  ¿ Oficines municipals de districte Correu electrònic ¿ Oficina d Info;;0029;urbanisme;;S;Documentació que cal aportar Sol·licitud normalitzada. ;Normativa Llei 30/1992 de Règim Jurídic de les Administracions Públiques i del  Procediment Administratiu Comú. ;;https://seu.badalona.cat/portalWeb/badalona.portal?_nfpb=true&_pageLabel=detall_tramit&dDocName=***001697#wlp_detall_tramit;23/05/2014;;;S;N;N;;Català 
***002810;Renovació de la inscripció padronal pels estrangers no comunitaris sense autorització de residència de llarga durada;;;0019;padró d habitants i Cens Electoral;;N; ; ;;https://seu.badalona.cat/portalWeb/badalona.portal?_nfpb=true&_pageLabel=detall_tramit&dDocName=***002810#wlp_detall_tramit;23/11/2016;;;S;N;N;;Català 
***001199;Atenció a les dones en situació de risc;Atenció i assessorament a dones en situació de risc.  Informació jurídica, psicològica i social en temes de crisi matrimonial,  maltractament. Qui ho pot demanar? Tothom Com es pot fer? Presencialment ¿ Oficina d Atenció a la Dona Correu electrònic ¿ Oficina d Atenció a la Dona Impresos model Cap Documentació que cal aportar Normativa Preu Gratuït Organisme responsable Atenció a la Dona Observacions </IdcteDoc;;;;;S;Documentació que cal aportar ;Normativa ;;https://seu.badalona.cat/portalWeb/badalona.portal?_nfpb=true&_pageLabel=detall_tramit&dDocName=***001199#wlp_detall_tramit;31/08/2010;;;S;N;N;;Català 
***003092;Llicència per cultivar un hort en finques municipals;Sol·licitud d¿una llicència per cultivar un hort en finques municipals Qui ho pot demanar? Ciutadans i ciutadanes empadronats a Badalona, que no tinguin activitat laboral i que tinguin  60 anys o més d¿edat Com es pot fer? Presencialment: Presentant la sol·licitud en el Registre General de l Ajuntament Documentació que cal aportar ¿ Document d identitat ¿ Historial de vida laboral ¿ Cert;;0016;medi ambient;;N;Documentació que cal aportar ¿ Document d identitat ¿ Historial de vida laboral ¿ Certificat mèdic d aptitud en els casos d invalidesa o discapacitat ;Normativa Reglament de Règim d¿ús dels horts de titularitat municipal i per l¿atorgament de llicències  d¿ús privatiu del domini públic. (BOP 245, de 13/10/2009) ;;https://seu.badalona.cat/portalWeb/badalona.portal?_nfpb=true&_pageLabel=detall_tramit&dDocName=***003092#wlp_detall_tramit;04/12/2014;;;S;N;N;;Català 
***003090;Autorització per treballs forestals en temps d alt risc d incendi;Sol·licitud d autorització per a la realització de treballs forestals en períodes d¿alt risc d¿incendi  forestal (Del 15 de març al 15 d¿octubre) Qui ho pot demanar? Propietaris i/o administradors de finques ubicades en zona forestal Com es pot fer? Presencialment ¿ Departament de gestió del Medi Natural i Paisatge Impresos model Adjunt Documentació que cal aportar DNI i acreditació de propietat de la finca o aut;;0016;medi ambient;;S;Documentació que cal aportar DNI i acreditació de propietat de la finca o autorització del propietari en altres casos. Imprès degudament complimentat ;Normativa ¿ Decret 64/1995, de 7 de març, de mesures de prevenció d¿incendis forestals. ¿ Ordre MAB/62/2003, de 13 de Febrer, de desplegament d¿aquestes mesures.  ;;https://seu.badalona.cat/portalWeb/badalona.portal?_nfpb=true&_pageLabel=detall_tramit&dDocName=***003090#wlp_detall_tramit;06/09/2010;;;S;N;N;;Català 
***014236;Preinscripció de l alumnat als centres educatius en els ensenyaments sufragats amb fons públics de Formació professional de grau superior;So l· licit u d  d ¿u n a  p la ça  e sco la r,  e n  un  cen t re  p úb lic  o  p riva t  co n ce rt a t  pe r  a  la  f o rma ció  pro fe ssio na l  d e  g rau  sup e rio r  Procediment.  L e sta b le rt  e n  la  no rma t iva  vige n t  e me sa  p e l  Dep a rt a me n t  d  E d u ca ció  d e  la  Ge ne ra lit a t  de  Ca t a lu n ya, Qui ho pot demanar? L¿alumne si és major d¿edat o be el pare, mare o tutors legals de l¿alumne, en el cas que sigui  menor d¿edat. L¿alumne cal que tingui el títol de batxiller o equivalent a efectes acadèmics. També s¿hi pot accedir si s¿ha superat la prova d¿accés corresponent. Per poder fer aquesta  prova cal tenir;;0010;educació;;N; ; ;;https://seu.badalona.cat/portalWeb/badalona.portal?_nfpb=true&_pageLabel=detall_tramit&dDocName=***014236#wlp_detall_tramit;11/03/2015;;;S;N;N;;Català 
