ID_TRAMIT;NOM_TRAMIT;DESCRIPCIO_TRAMIT;TEMA;CODI_AMBIT;DESCRIPCIO_AMBIT;IMMEDIAT;GRATUIT;REQUISITS;NORMATIVA_APLICABLE;RESPONSABLE;ENLLACOS_RELACIONATS;DATA_CREACIO;PARAULES_CLAU;CANAL_TELEMATIC;CANAL_PRSENCIAL;CANAL_TELEFONIC;CANAL_MOBIL;CANAL_QUIOSC;IDIOMA
***042084;Baixa d una subscripció a la Newsletter Cultural  InBadalona  ;per tal de deixar de rebre la Newsletter  InBadalona  que  edita l¿Àrea de Cultura i Ciutadania i que s envia periòdicament als usuaris amb  un recull de les activitats culturals més destacades que es fan a Badalona. Qui ho pot demanar? Tots els ciutadans que s¿han subscrit a la Newsletter Cultural `InBadalona¿. Com es pot fer? Com es pot fer? En línia Mitjançant el tràmit en línia, clicant al link `Fes-ho ara¿ i omplint les dades que  es demanen en el formulari. Després de sol.licitar la baixa de la subscripció, rebreu un correu electrònic a la  vostra bústia, per tal que la confirmeu. La baixa també la podeu fer d;;0006;cultura;;S; ; ;;https://seu.badalona.cat/portalWeb/badalona.portal?_nfpb=true&_pageLabel=detall_tramit&dDocName=***042084#wlp_detall_tramit;19/03/2013;;;N;N;N;;Català 
***040854;Exercici del dret d oposició de dades de caràcter personal;Sol·licitar l exercici del dret  del titular de les dades a que no es porti a terme  el tractament de les seves dades de caràcter persona o que es cessi el seu  tractament en els següents supòsits: - Quan no sigui necessari el consentiment per al seu tractament, com  conseqüència d un motiu legítim i fonamentat que ho justifiqui, i sempre que  una Llei no disposi el contrari. - Quan es tracti de fitxers que tinguin per finalitat la realització d activitats  publicitàries i prospecció comercial. - Quan el tractament tingui per finalitat l adopció d una decisió referida a  l afectat i basada únicament en un tractament automatitzat de les seves  dades de caràcter personal, en els termes previstos  en l art. 36 del RD  1720/2007. Qui ho pot demanar? El titular de les dades. Quan el titular de les dades sigui un menor d edat o es trobi en situació  d incapacitat podrà exercir aquest dret el seu representant legal, que haurà  d acreditar aquesta condició. Aquest dret també podrà exercir-se a través de representant voluntari,  expressament design;;;;;N;Documentació que cal aportar - DNI, passaport o document equivalent. - Acreditació poders de representació (en cas de menor d¿edat o persona  incapacitada) - Acreditació / justificació de les dades que es demana rectificar ; ;;https://seu.badalona.cat/portalWeb/badalona.portal?_nfpb=true&_pageLabel=detall_tramit&dDocName=***040854#wlp_detall_tramit;03/12/2014;;;S;N;N;;Català 
***015837;Llicències d ocupació temporal de la via pública;om es pot fer?Servei d¿Atenció al Ciutadà Serveis i tràmits En què consisteix el tràmit? Les Llicències d¿ocupació de la via pública d¿instal·lacions temporals desmuntables suposa  l¿autorització temporal (que no superin l¿any) de l¿espai destinat a ús públic. Els diferents  tipus de llicències per;;0029;urbanisme;;N; ; ;;https://seu.badalona.cat/portalWeb/badalona.portal?_nfpb=true&_pageLabel=detall_tramit&dDocName=***015837#wlp_detall_tramit;26/09/2016;;;S;N;N;;Català 
***014231;Preinscripció de l alumnat d educació infantil a escoles bressol municipals i llars d infants de la Generalitat de Catalunya;So l· licit u d   d ¿un a   p la ça   esco la r   a   le s   Esco le s   B re sso l   Mu n icip a ls   i   a   le s  L la rs  d ¿in fa n t s d e  la  Ge ne ra lit a t  de  Ca t a lun ya.         Procediment.  L e sta b le rt  e n  la  no rma t iva  vige n t  e me sa  p e l  Dep a rt a me n t  d  E d u ca ció  d e  la  Ge ne ra lit a t  de  Ca t a lu n ya, En  un a  ú n ica  so l· licit ud  s¿h i  po de n  in d ica r  pe t icion s  d ¿ad missió  e n  d ive rso s  ce n t re s. En  t ot s  els  ca so s  s ha  de  lliu ra r  a l  so l· licit an t  còp ia  d at a da  i  se g e llad a  q ue  n ¿a cre d it i la  p re se n ta ció . Qui ho pot demanar? E l   pa re ,   la   ma re   o     e ls   t ut o rs   le g a ls   d e   l¿a lu mn e   q ue   p e r   a   se r   ad mè s   o  ad me sa   a   aq ue sta   et ap a   ca l   q ue   t in g u i,   co m   a   mí n im,   1 6   set ma ne s   l 1   de  se t e mb re  d e l¿a n y en  qu è s¿in icia  e l cu rs. ;;0010;educació;;N;Documentació que cal aportar Do cu me nt a ció  an ne xa ;Normativa Resolució ENS/406/2017, de 24 de febrer, del  procediment de preinscripció i matrícula de  l¿alumnat als centres del Servei d¿Educació de Catalunya i altres centres educatius, en els  diversos ensenyaments sostinguts amb fons públics, per al curs 2017-2018. ;;https://seu.badalona.cat/portalWeb/badalona.portal?_nfpb=true&_pageLabel=detall_tramit&dDocName=***014231#wlp_detall_tramit;15/03/2017;;;S;N;N;;Català 
***001212;CASAMENTS civils ;Reserva de dia i hora per a la celebració del matrimoni civil en el Saló de  Plens municipal. Les cerimònies se celebren els dissabtes (excepte els festius, els ponts i el  mes d¿agost i quan hi hagi un acte oficial programat). Addicionalment també es pot fer la Consulta i anul·lació de les cites prèvies.  Qui ho pot demanar? - Qualsevol persona major d¿edat. - Els menors de 14 a 16 anys hauran d¿obtenir prèviament el permís del  Registre Civil. - Els menors de 16 a 18 anys podran ésser emancipats per concessió dels  seus pares o dels que ostentin la pàtria potestat. Com es pot fer? Presencialment: Departament de Protoc;;;;;N; ; ;;http://badalona.cat/appExtSC/citaprevia/solicitudPaso2!ccbs?idServicio=1&idAmbito=1&idDepartamento=1&idTramite=1&idAgenda=1;28/02/2017;;;S;N;N;;Català 
***002799;Certificació registre municipal d unions civils;Obtenció d¿una certificació sobre la inscripció al Registre Municipal d¿Unions  Civils. El Registre d¿Unions Civils ha quedat suprimit pel Decret d¿Alcaldia, de 22 de  febrer de 2012 (BOP 05/03/2012). És   possible   sol·licitar   la   certificació   d¿una   inscripció   realitzada   abans  d¿aquesta data. Qui ho pot demanar? Qualsevol  persona  major  d¿edat  no  incapacitada  que  estigui  o  hagi  estat  empadronada a Badalona Com es pot fer? Presencialment  ¿ Departament d¿Estadística i Població  Impresos model Cap Documents acreditatius de la identitat del sol·licitant:  ¿ Majors d¿edat de nacionalitat espanyola  :;;0019;padró d habitants i Cens Electoral;;N; ; ;;https://seu.badalona.cat/portalWeb/badalona.portal?_nfpb=true&_pageLabel=detall_tramit&dDocName=***002799#wlp_detall_tramit;25/01/2013;;;S;N;N;;Català 
***001203;Exercici del dret de rectificació de dades de caràcter personal;Sol·licitar l exercici del dret  del titular de les dades a que es modifiquin les  dades que siguin inexactes o incompletes. Qui ho pot demanar? El titular de les dades. Quan el titular de les dades sigui un menor d edat o es trobi en situació  d incapacitat podrà exercir aquest dret el seu representant legal, que haurà  d acreditar aquesta condició. Aquest dret també podrà exercir-se a través de representant voluntari,  expressament design;;;;;S;Documentació que cal aportar - DNI, passaport o document equivalent. - Acreditació poders de representació (en cas de menor d¿edat o persona  incapacitada) - Acreditació / justificació de les dades que es demana rectificar  ;Normativa Llei orgànica 15/1999, de 13 de desembre, de protecció de dades de caràcter  personal (LOPD) Reial Decret 1720/2007, de 21 de desembre , mitjançant el qual s aprova el  Reglament de desenvolupament de la Llei Orgànica 15/1999, de protecció de  dades de caràcter personal. ;;https://seu.badalona.cat/portalWeb/badalona.portal?_nfpb=true&_pageLabel=detall_tramit&dDocName=***001203#wlp_detall_tramit;03/12/2014;;;S;N;N;;Català 
***040853;Exercici del dret de cancel.lació de dades de caràcter personal;Sol·licitar l exercici del dret  del titular de les dades a que es suprimeixin les  seves dades que siguin inadequades o excessives. Qui ho pot demanar? El titular de les dades. Quan el titular de les dades sigui un menor d edat o es trobi en situació  d incapacitat podrà exercir aquest dret el seu representant legal, que haurà  d acreditar aquesta condició. Aquest dret també podrà exercir-se a través de representant voluntari,  expressament design;;;;;S;Documentació que cal aportar - Document d identitat - Acreditació de poders de representació  - Documentació justificativa de la cancel·lació ;Normativa Llei orgànica 15/1999, de 13 de desembre, de protecció de dades de caràcter  personal (LOPD) Reial Decret 1720/2007, de 21 de desembre , mitjançant el qual s aprova el  Reglament de desenvolupament de la Llei Orgànica 15/1999, de protecció de  dades de caràcter personal. ;;https://seu.badalona.cat/portalWeb/badalona.portal?_nfpb=true&_pageLabel=detall_tramit&dDocName=***040853#wlp_detall_tramit;03/12/2014;;;S;N;N;;Català 
***040278;Consulta i anul.lació de Cita prèvia;/Idctecreation_date>  <Idcteprimary_author>Jose Antonio</Idcteprimary_author>  <IdcteCreator>Writer</IdcteCreator>  <Idctepublisher>OpenOffice.org 3.1</Idctepublisher>   En què consisteix el tràmit? Aquest tràmit consisteix en poder fer una Consulta o anul·lació d¿una cita   prèvia, sol·licitada anteriorment.  Qui ho pot demanar? Qualsevol ciutadà. Com es pot fer? E;;;;;S; ; ;;http://badalona.cat/appExtSC/citaprevia/verConsulta.action;23/05/2014;;;N;N;N;;Català 
***002811;Baixa de persones empadronades a un domicili on no hi resideixen;Sol·licitud   per   la   qual   s¿inicien   els   tràmits   per   donar   de   baixa   al   padró  municipal aquelles persones que consten empadronades en un domicili en el  qual no hi resideixen.  Davant una sol·licitud d¿inici dels tràmits de baixa per inclusió indeguda en el  padró municipal d¿habitants, es dóna audiència als afectats perquè puguin  demostrar la seva residència efectiva en el domicili. Pels qui no es presenten,  d¿acord amb l¿article 72 del Reglament de Població i Demarcació Territorial  de les Entitats Locals (nova redacció donada pel Reial decret 2612/1996, de  20 de desembre), es demana informe favorable al Consell d¿Empadronament.  En el cas d¿informe favorable, es procedeix a fer efectiva la baixa padronal,  mitjançant Resolució motivada de l¿alcalde, notificant-ho als afectats i essent  publicada la Resolució al Butlletí Oficial de l¿Estat. Aquest procediment té caràcter extraordinari, ja que les baixes en el padró es  produeixen   de   manera   automàtica   en   qualsevol   de   les   circumstàncies  següents: ¿ Quan la persona realitza un canvi de domicili en el mateix municipi. ¿ Quan la persona realitza una inscripció d¿alta en el padró d¿habitants  de qualsevol altre municipi d¿Espanya. ¿ Quan   la   persona,   si   és   de   nacionalitat   espanyola,   realitza   una  inscripció  en  el  registre  consular  de  qualsevol  consolat  espanyol  a  l¿estranger. ¿ Quan la persona, si és estrangera no comunitària i sense permís de  residència permanent, no renova la seva inscripció en el padró cada 2  anys. Qui ho pot demanar? El titular de la vivenda ;;0019;padró d habitants i Cens Electoral;;N; ; ;;https://seu.badalona.cat/portalWeb/badalona.portal?_nfpb=true&_pageLabel=detall_tramit&dDocName=***002811#wlp_detall_tramit;23/11/2016;;;S;N;N;;Català 
***027860;Preinscripcions d activitats aquàtiques del mes de juliol;Sol·licitud d¿inscripció a les activitats aquàtiques de juliol  Les activitats aquàtiques d¿estiu programades pel mes de juliol i adreçades a  infants, joves i adults de la nostra ciutat, engloba tot un seguit d¿activitats  com:  cursets  de  natació  per  aprendre  a  nedar  i/o  perfeccionar  els  estils,  activitat  física  i  de  relax  amb  música  dins  l¿aigua  i  un  seguit  de  serveis  esportius   amb   l¿objectiu   de   divertir-se   i  relacionar-se,  i   especialment   per  aprendre  a  nedar,  millorar  la  tècnica  de  la  natació,  fomentar  una  activitat  saludable i millorar les qualitats físiques bàsiques.  L¿objectiu general d¿aquesta activitat és promoure la pràctica esportiva entre  la població de la ciutat i, en particular, iniciar-los a la pràctica de la natació  com a un coneixement bàsic de supervivència en un medi aliè com és l¿aigua.  Tot   això   sense   deixar   de   banda   altres   objectius   o   beneficis   físics   a  determinades edats. Qui ho pot demanar? Qualsevol persona física major d¿edat i, en cas de menors d¿edat, el pare, la  mare o el tutor legal. Fases del procediment 1. Preinscripció  2. Comunicació (via correu electrònic o telèfon) del número del sorteig  assignat 3. Publicació de la llista d¿admesos i comunicació incidències. 4. Adjudica;;;;;N; ; ;;https://seu.badalona.cat/portalWeb/badalona.portal?_nfpb=true&_pageLabel=detall_tramit&dDocName=***027860#wlp_detall_tramit;26/09/2016;;;S;N;N;;Català 
***002800;Cancel¿lació inscripció registre unions civils;Cancel·lació de la inscripció en el Registre Municipal d¿Unions Civils.  L¿Ajuntament comprovarà la inscripció efectiva al Registre i el/la sol·licitant  signa la petició de cancel·lació. El Registre d¿Unions Civils ha quedat suprimit pel Decret d¿Alcaldia, de 22 de  febrer de 2012 (BOP 05/03/2012). És   possible   sol·licitar   la   cancel·lació   d¿una   inscripció   realitzada   abans  d¿aquesta data. Qui ho pot demanar? Un o els dos membres de la parella inscrita en el Registre Municipal d¿Unions  Civils. Com es pot fer? Presencialment  (n¿hi   ha   prou   amb   que   vingui   una   de   les   dues   persones   per   signar   la  sol·licitud de cancel·lació) ¿ Departament d¿Estadística i Població  Impresos model C;;0019;padró d habitants i Cens Electoral;;N;Documentació que cal aportar Documents acreditatius de la identitat del sol·licitant:  ¿ Majors d¿edat de nacionalitat espanyola: DNI o passaport. ¿ Estrangers   d¿un   país   membre   de   la   Unió   Europea,   d altres   estats  membres   de   l¿Espai   Econòmic   Europeu   (Noruega,   Islàndia   i  Liechtenstein)   i   de   Suïssa   (en   virtut   de   l acord   de   Luxemburg):  document   d identitat   del   país   d origen   o   passaport   en   vigor,  Plaça Assemblea ******************, planta baixa CIF: P-080**** J 08911 Badalona www.badalona.cat T. 93.483.**.**-F.93.483.**.** correu*************  Serveis i tràmits acompanyat  del  certificat  del  Registre  Central  d Estrangers,  cas  de  disposar-ne. ¿ Estrangers no comunitaris: targeta de residència en vigor o passaport  en vigor. ; ;;https://seu.badalona.cat/portalWeb/badalona.portal?_nfpb=true&_pageLabel=detall_tramit&dDocName=***002800#wlp_detall_tramit;25/01/2013;;;S;N;N;;Català 
***040297;Cita prèvia per gestions del Certificat digital (IDCAT);isteix en poder demanar una cita prèvia (dia/hora) per poder  fer una consulta o gestió relacionada amb el Certificat Digital: d¿IdCat. Addicionalment també es pot fer la Consulta i anul·lació de les cites prèvies  .   Qui ho pot demanar? Qualsevol persona física major d¿edat. Com es pot fer? En línia Mitjançant el tràmit en línia, clicant al link `Demana cita! En línia¿. Cal anar  seguint les passes que proposa el sistema. En cas de dubte, podeu veure les  Instruccions a l¿apartat `Documentació¿. Quan s¿acaba la petició de la cita prèvia mitjançant la Web, el programa emetrà  un document  amb les dades de la cita i u;;;;;S; ; ;;http://badalona.cat/appExtSC/citaprevia/solicitudPaso2!ccbs?idServicio=22&idAmbito=22&idDepartamento=22&idTramite=22&idAgenda=41;27/02/2017;;;S;N;N;;Català 
***042083;Subscripció a la Newsletter Cultural  InBadalona ;r tal de rebre la Newsletter `InBadalona¿ que edita l¿Àrea de  Cultura i Ciutadania i que s¿envia periòdicament als usuaris amb un recull de  les activitats culturals més destacades que es fan a Badalona. Qui ho pot demanar? Tots els ciutadans Com es pot fer? En línia Mitjançant el tràmit en línia, clicant al link `Fes-ho ara¿ i omplint les dades que  es demanen en el formulari. La subscripció també la podeu fer des de la mateixa Newsletter. Documentació que cal aportar No se¿n requereix. Preu Gratuït Període de tramitació Tot l any Termini de resolució Immediat Organisme responsable Departament d¿Acció ;;0006;cultura;;S; ; ;;https://seu.badalona.cat/portalWeb/badalona.portal?_nfpb=true&_pageLabel=detall_tramit&dDocName=***042083#wlp_detall_tramit;19/03/2013;;;N;N;N;;Català 
***041286;Cita prèvia per CONSUM;Aquest  tràmit  consisteix  en  poder  demanar  una  cita  prèvia  (dia/hora)  per  poder fer una consulta o gestió relacionada amb el Departament de Consum. Addicionalment també es pot fer la Consulta i anul·lació de les cites prèvies. Qui ho pot demanar? Qualsevol ciutadà, resident a Badalona. Com es pot fer? En línia Mitjançant el tràmit en línia, clicant al link `Demana Cita! En línia¿. Cal anar  seguint les passes que proposa el sistema. En cas de dubte, podeu veure les  Instruccions a l¿apartat `Documentació¿. Quan  s¿acaba  la  petició  de  la;;0034;comerç;;S; ; ;;http://badalona.cat/appExtSC/citaprevia/solicitudPaso2!ccbs?idServicio=42&idAmbito=42&idDepartamento=42&idTramite=62&idAgenda=62;27/02/2017;;;S;N;N;;Català 
***080063;Cita prèvia Habitatge;Aquest tràmit consisteix en poder demanar una cita prèvia (dia/hora) per a  realitzar   una   assessoria  en  temes  d¿habitatge  amb   un/a  orientador/a  del  Badiu Jove que posarà a l¿abast tota la informació sobre ajudes al lloguer i a  la compra, accés a pisos de protecció oficial, lloguer per a joves, requisits i  condicions per compartir pis, compra i venda d¿un pis, hipoteques, etc.  Addicionalment també es pot fer la Consulta i anul·lació de les cites prèvies. Qui ho pot demanar? Joves fins a 35 anys. Com es pot fer? En línia Mitjançant el tràmit en línia, clicant al link `Demana cita! En línia¿. Cal anar  seguint les passes que proposa el sistema. En cas de dubte, podeu veure les  Instruccions a l¿apartat `Documentació¿. Quan  s¿acaba  la  petició  de  la  cita  prèvia  mi;;;;;S; ; ;;http://badalona.cat/appExtSC/citaprevia/solicitudPaso2!ccbs?idServicio=102&idAmbito=62&idDepartamento=122&idTramite=183&idAgenda=184;28/02/2017;;;S;N;N;;Català 
***074503;Inscripció a la jornada del Procés Participatiu Rambla-Canal-Port;Formulari  emès  per  l¿Ajuntament  de  Badalona  per  tal  que  la  ciutadania,  especialment  del  districte número cinc (barris de Gorg, Can Claris, Raval, Congrés i La Móra) es puguin inscriure  a la Jornada del Procés Participatiu Rambla-Canal-Port, del dia 27 de febrer del 2016. Aforament limitat, entrada per ordre d¿inscripció. Preferència pertinença al districte. Qui ho pot demanar? Qualsevol ciutadà, especialment del districte indicat. Com es pot fer? En línia Mitjançant el formulari electrònic publicat en aquesta Seu electrònica. Només cal clicar al link   Fes-ho ara!. En línia  i seguir les indicacions. Telefònicament Departament d¿Atenció al Ciutadà i OMD número 5  (Avingu;;;;;S; ; ;;https://seu.badalona.cat/portalWeb/badalona.portal?_nfpb=true&_pageLabel=detall_tramit&dDocName=***074503#wlp_detall_tramit;03/02/2016;;;S;N;N;;Català 
***003208;Pre-inscripció per participar en el Mercat del Trasto;cació d¿obtenció de plaça es farà a partir del dia 25 D¿ABRIL  MERCAT DEL TRASTO DIA: 30/04/2017  En que consisteix el tràmit? El Mercat del Trasto  és un mercat d¿objectes usats o fets amb material reciclat, que  organitza l¿Àrea de Medi Ambient i Sostenibilitat de l¿Ajuntament de Badalona. La  participació  és  oberta  a  tota  la  ciutadania,  es  pot  fer  de  manera  individual  o  en  representació   d¿una   entitat   o   associació,   i   està   prohibida   la   participació   de  professionals del comerç. Per  participar-hi,  cal  dur  a  terme  la  pre-inscripció  quan  estigui  prevista  la  seva  celebració,  que  en  principi  acostuma  a  ser  sobre  uns  30  dies  abans  de  la  data  assenyalada.   Les   diverses   edicions   són   publicades   amb   suficient   antelació   als  mitjans de comunicació i en aquesta web. Qui ho pot demanar? Qualsevol   persona   física  que   no  exerceixi  activitats  empresarials  de   distribució  comercial. Com es pot fer? On line Mitjançant el formulari electrònic publicat en aquesta Seu electrònica. Només cal  clicar al link   Fes-ho ara. On line  i seguir les indicacions. Presencialment ¿ Àrea ;;0016;medi ambient;;N; ; ;;https://seu.badalona.cat/portalWeb/badalona.portal?_nfpb=true&_pageLabel=detall_tramit&dDocName=***003208#wlp_detall_tramit;18/04/2017;;;S;N;N;;Català 
***047193;Cita prèvia per informació de VIA PÚBLICA;isteix en poder demanar una cita prèvia (dia/hora) per poder  fer una consulta o gestió amb un/a tècnic/a de l¿Ajuntament relacionada amb la  Via Pública: - Guals - Clavegueram - Ocupació via pública - Reserves d¿aparcaments... Addicionalment també es pot fer la Consulta i anul·lació de les cites prèvies. Qui ho pot demanar? Qualsevol ciutadà. Com es pot fer? En línia Mitjançant el tràmit en línia, clicant al link `Demana cita! En línia¿. Cal anar  seguint les passes que proposa el sistema. En cas de dubte, podeu veure les  Instruccions a l¿apartat `Documentació¿. Quan s¿acaba la petició de la cita prèvia mitjançant el Web, el programa emetrà  un document  amb les dades de la cita i un `codi localitzador;;0029;urbanisme;;N; ; ;;http://badalona.cat/appExtSC/citaprevia/solicitudPaso2!ccbs?idServicio=22&idAmbito=22&idDepartamento=22&idTramite=102&idAgenda=102;27/02/2017;;;S;N;N;;Català 
***036878;Autoliquidació de l IVTM;Estan   subjectes   al   pagament   de   l¿Impost   sobre   Vehicles   de   Tracció  Mecànica   tots   els   propietaris   de   vehicles   donats   d¿alta   a   la   ciutat   de  Badalona.  L¿alta  del  vehicle  es  tindrà  que  comunicar a  la  Prefectura  de  Trànsit.  El tràmit dependrà de si el vehicle és nou o de segona mà. Vehicles nous Per tal de matricular el vehicle a la Prefectura de Trànsit, i donar-lo d¿alta al  padró  de  vehicles  de  l¿Ajuntament  de  Badalona,  s¿ha  de  liquidar  l¿IVTM  d¿acord   amb   les   tarifes   vigents.   La   quota   es   prorrateja   per   trimestres  naturals i el pagament de la part proporcional de l¿any s¿ha de fer mitjançant  autoliquidació. Aquest tràmit es pot fer telemàticament, a travès del web de  la L¿ORGT, o presencialment als punts d informació i gestió que l ORGT té  a la seu de Trànsit de Barcelona i Sabadell.   Vehicles transferits   (de segona mà)   La venda o transferència d¿un vehicle s¿ha de comunicar a la Prefectura  Provincial de Trànsit presentant el justificant de pagament de l¿any en curs  el qual està obligat a pagar el titular del vehicle el dia 1 de gener.  Una vegada presentat el document de transferència a la prefectura, Trànsit  comunica l¿alta del vehicle a l¿Ajuntament per incloure¿l al padró de l¿exercici  següent.   Qui ho pot demanar?  La persona titular del  vehicle o el representat legal degudament autoritzat,  aportant la següent documentació:  - NIF/CIF del titular del vehicle - Fitxa tècnica del vehicle (si es tracta d¿un vehicle nou) - Permís de circulació (si es tracta d¿un vehicle transfer;;0036;tributs;;N; ; ;;http://orgt.diba.cat/cat/T11altveh.asp?cdclie=015&municipi=1;03/06/2015;;;S;N;N;;Català 
***050536;Proposta d informe de disponibilitat i adequació de l habitatge per renovació de l autorització de residència per reagrupament familiar;novació de l¿autorització de residència temporal per reagrupament familiar que poden  obtenir els familiars reagrupats.  La tramitació es fa directament a la Subdelegació del Govern, llevat que  el reagrupament i la seva família hagin canviat de domicili, en aquest cas, serà obligatori que l¿interessat  aporti un nou informe de disponibilitat i adequació de l¿habitatge en el qual resideixi en el moment de la  renovació. Qui ho pot demanar? Qualsevol persona estrangera no comunitària, major d¿edat, empadronada a Badalona, que disposi d¿una  autorització de residència renovada o en procès de renovació, i vulgui sol¿licitar el reagrupament dels  seus familiars Com es pot fer? Presencialment:  Presentant la sol·licitud i la documentació requerida al departament d Immigració Documentació que cal aportar a) Sol·licitud, mode;;;;;N; ; ;;https://seu.badalona.cat/portalWeb/badalona.portal?_nfpb=true&_pageLabel=detall_tramit&dDocName=***050536#wlp_detall_tramit;04/06/2015;;;S;N;N;;Català 
***079275;O2.2 W2.2 PLATAFORMES ELEVADORES PER SUPRESSIÓ DE BARRERES ARQUITECTÒNIQUES;cessàries   per   a   la   instal·lació   de   plataformes   elevadores   a   efectes   de  supressió  de  barreres  arquitectòniques  que  no  afectin  l¿estructura  de  l¿edifici,  en  finques que no estiguin incloses en el Catàleg de Patrimoni i que no estiguin fora  d¿ordenació.  En què consisteix el tràmit? Comunicació d¿obres necessàries per a la instal·lació de plataformes elevadores a efectes  de supressió de barreres arquitectòniques que no afectin l¿estructura de l¿edifici, en finques  que no estiguin incloses en el Catàleg de Patrimoni i que no estiguin fora d¿ordenació.  Qui ho pot demanar? Qualsevol persona física o jurídica. Impresos model - Instància de comunicació normalitzada (O2 W2). - Declaració responsable del/la la tècnic/a competent. - Manifestació del/a contractista. Requisits previs - Els   instruments   de   planejament   i   gestió   corresponents   han   d¿estar   apro;;0029;urbanisme;;N; ; ;;https://seu.badalona.cat/portalWeb/badalona.portal?_nfpb=true&_pageLabel=detall_tramit&dDocName=***079275#wlp_detall_tramit;06/07/2016;;;S;N;N;;Català 
