ID_TRAMIT;NOM_TRAMIT;DESCRIPCIO_TRAMIT;TEMA;CODI_AMBIT;DESCRIPCIO_AMBIT;IMMEDIAT;GRATUIT;REQUISITS;NORMATIVA_APLICABLE;RESPONSABLE;ENLLACOS_RELACIONATS;DATA_CREACIO;PARAULES_CLAU;CANAL_TELEMATIC;CANAL_PRSENCIAL;CANAL_TELEFONIC;CANAL_MOBIL;CANAL_QUIOSC;IDIOMA
***001603;Renúncia d un vehicle fora d ús;Renúncia d un vehicle fora d ús (abandonament) Qui ho pot demanar? Qui consti com a titular del vehicle o el seu representant legal. Com es pot fer? Presencialment ¿ Prefectura de la Guàrdia Urbana, Oficina d Atenció al Ciutadà  ¿ Oficines Municipals de Districte. Impresos model Imprès de renuncia  Documentació que cal aportar ¿ Permís de circulació  ¿ Targeta d I;;0022;seguretat;;S;Documentació que cal aportar ¿ Permís de circulació  ¿ Targeta d Inspecció Tècnica  ¿ Fotocòpia del DNI  ¿ Imprès de renúncia ¿ Claus, si se¿n disposa.  ;Normativa ¿ Llei 10/1998 de 21 d¿abril vers residus. ¿ Decret de Generalitat de Catalunya 217/1999.  ;;https://seu.badalona.cat/portalWeb/badalona.portal?_nfpb=true&_pageLabel=detall_tramit&dDocName=***001603#wlp_detall_tramit;23/05/2014;;;S;N;N;;Català 
***027194;Sol·licitud de construcció-reparació de clavegueró;ualsevol persona física o jurídica, pública o privada, per ella mateixa o a través de representant.Com es pot fer?Documentació que cal aportarEn cas de no ser el propietari, poders notarials de representació, o en el seu defecte copia acreditativa de l acta de nomenament d administrador, President de la comunit;;0029;urbanisme;;N;Documentació que cal aportarEn cas de no ser el propietari, poders notarials de representació, o en el seu defecte copia acreditativa de l acta de nomenament d administrador, President de la comunitat, o persona habilitada per actuar en representació.;Normativa ;;https://seu.badalona.cat/portalWeb/badalona.portal?_nfpb=true&_pageLabel=detall_tramit&dDocName=***027194#wlp_detall_tramit;26/09/2016;;;S;N;N;;Català 
***078415;IC INFORME DE COMPATIBILITAT URBANÍSTICA;ue consisteix el tràmit? Sol·licitud de l¿informe urbanístic acreditatiu de que l¿activitat que es pretén ubicar es compatible  amb el planejament urbanístic, i de la disponibilitat i suficiència dels serveis públics que exigeixi  la mateixa d¿acord amb el que preveuen els arts. 39 i 60 de la Llei 20/2009, del 4 de desembre,  de prevenció i control ambiental de les activitats Qui ho pot demanar? Qualsevol persona física o jurídica  Com es pot fer? Presencialment Impresos model - Instancia de sol·licitud normalitzada.  - Full d¿autoliquidació de taxes. Documentació que cal aportar - 2 còpies de la instància de sol·licitud normalitzada. - Plànol d¿emplaçament de l¿activitat projectada que p;;0029;urbanisme;;N;Documentació que cal aportar - 2 còpies de la instància de sol·licitud normalitzada. - Plànol d¿emplaçament de l¿activitat projectada que permeti una identificació indubtable de  la finca. - Memòria   descriptiva   de   l¿activitat   que   expliciti   la   seva   naturalesa   i   característiques  principals. Aquesta memòria ha de contenir les dades i referents necessaris per tal que  l¿ajuntament pugui determinar, en base a les limitacions contingudes en la normativa i el  planejament, la seva compatibilitat o incompatibilitat. - Resguard acreditatiu d¿haver efectuat el pagament de la taxa per a l¿emissió de l¿informe  de compatibilitat urbanística, d¿acord amb allò que disposi la corresponent Ordenança  fiscal (model normalitzat). ;Normativa - Llei  20/2009,   del   4   de   desembre,   de   prevenció   i   control   ambiental  de   les   activitats  (LPCAA).  - Ordenança fiscal núm.12 ;;https://seu.badalona.cat/portalWeb/badalona.portal?_nfpb=true&_pageLabel=detall_tramit&dDocName=***078415#wlp_detall_tramit;24/03/2017;;;S;N;N;;Català 
***078375;B2 COMUNICACIÓ MUNICIPAL; tràmit? Comunicació prèvia a l inici d activitats d¿activitats innòcues.  Qui ho pot demanar? Qualsevol persona física o jurídica que vulgui ser titular d¿una activitat.  Com es pot fer? Presencialment Impresos model Els podeu descarregar en pdf de la columna de la dreta. Documentació que cal aportar Documentació tècnica (2 còpies),  signada per l interessat i el tècnic. El contingut mínim;;0029;urbanisme;;N; ; ;;https://seu.badalona.cat/portalWeb/badalona.portal?_nfpb=true&_pageLabel=detall_tramit&dDocName=***078375#wlp_detall_tramit;08/06/2016;;;S;N;N;;Català 
***016021;Acollida d¿animals en el CCAAC;;;0021;sanitat;;N; ; ;;https://seu.badalona.cat/portalWeb/badalona.portal?_nfpb=true&_pageLabel=detall_tramit&dDocName=***016021#wlp_detall_tramit;23/05/2014;;;S;N;N;;Català 
***016022;Adopció d¿animals de companyia;;;0021;sanitat;;N; ;Normativa Llei  18/2009  de 22 d¿octubre  de salut  pública Decret  legislatiu  2/2008,  de  15  d abril,   pel  qual  s aprova  el  text  refós  de la Llei  de protecció  dels animals.   Decret  328/1988  Registre  General  d¿Animals  de Companyia.   1  Serveis i tràmits ;;https://seu.badalona.cat/portalWeb/badalona.portal?_nfpb=true&_pageLabel=detall_tramit&dDocName=***016022#wlp_detall_tramit;23/05/2014;;;S;N;N;;Català 
***016005;Molèsties causades per situacions d insalubritat ;;;0021;sanitat;;N; ; ;;https://seu.badalona.cat/portalWeb/badalona.portal?_nfpb=true&_pageLabel=detall_tramit&dDocName=***016005#wlp_detall_tramit;29/03/2011;;;S;N;N;;Català 
***078432;IB INFORME PRECEPTIU DE BOMBERS;àmit? Sol·licitud de l¿informe de la Direcció General de Prevenció, Extinció d¿Incendis i Salvaments de la  Generalitat en els supòsits següents (simultàniament): 1. Activitat classificada dins dels annexos de la Llei 3/2010, de 18 de febrer, de Prevenció i  seguretat en matèria d¿incendis en establiments, activitats, infraestructures i edificis. 2. Quan el tràmit de l¿informe preceptiu no es fa dins cap altre tràmit de llicència. Qui ho pot demanar? Qualsevol persona física o jurídica  Com es pot fer? Qualsevol persona física o jurídica  Impresos model Podeu descarregar de la columna de la dreta. Documentació que cal aportar Instància de sol·licitud normalitzada. 2 còpies del projecte en matèria d¿incendis Formulari SP01 referent a la inspecc;;0029;urbanisme;;N;Documentació que cal aportar Instància de sol·licitud normalitzada. 2 còpies del projecte en matèria d¿incendis Formulari SP01 referent a la inspecció tècnica en matèria d¿incendis, omplert, que es pot trobar a  la web de la DGPEIS. Còpia de la documentació tècnica en format digital. Els arxius no podran superar els 10 Mb cada  un i no podrà haver-hi més de 10 arxius. Formulari SP02, de la mateixa web, que és la declaració de coincidència de la documentació en  suport paper amb la còpia digital. Full de declaració de dades a efectes de càlcul de la taxa. Si el projecte no està visat, declaració responsable de tècnic competent. ;Normativa Llei 3/2010, de 18 de febrer, de Prevenció i seguretat en matèria d¿incendis en establiments,  activitats, infraestructures i edificis. Ordenança fiscal número 13. ;;https://seu.badalona.cat/portalWeb/badalona.portal?_nfpb=true&_pageLabel=detall_tramit&dDocName=***078432#wlp_detall_tramit;09/06/2016;;;S;N;N;;Català 
***078399;CT CANVI DE TITULAR D UNA ACTIVITAT JA LEGALITZADA;US A/CT) En que consisteix el tràmit? Comunicació prèvia per a un canvi de titularitat d¿una autorització, llicència o títol habilitant  atorgats per a l¿exercici  d¿una activitat  d¿acord amb el que preveu l¿art. 28 de l Ordenança  Municipal d¿Activitats i d¿Intervenció Ambiental, presentada a l¿Ajuntament, acompanyada de  la documentació legalment preceptiva, per la que es posa en coneixement d¿aquest que es  procedirà   a   un   canvi   de   titularitat,   sota   l¿exclusiva   responsabilitat   de   les   persones  interessades, transmitents i tècniques, des de la data de la seva presentació, sense perjudici  de les facultats de comprovació, control i inspecció que tingui atribuïdes l¿Ajuntament.  Qui ho pot demanar? Qualsevol   persona   física   o   jurídica   interessada   que   vulgui   comunicar   prèviament   a  l¿Ajuntament el canvi de titularitat d¿una autorització, llicència o títol habilitant atorgats per a  l¿exercici d¿una activitat. Com es pot fer? Presencialment Impresos model: - Instància de sol;;0029;urbanisme;;N; ; ;;https://seu.badalona.cat/portalWeb/badalona.portal?_nfpb=true&_pageLabel=detall_tramit&dDocName=***078399#wlp_detall_tramit;08/06/2016;;;S;N;N;;Català 
***003205;Registre com voluntari mediambiental;Les persones que ho sol·licitin s¿inscriuran en el Registre de voluntaris ambientals Qui ho pot demanar? Les persones interessades en col·laborar amb l Ajuntament en tasques de promoció i difusió  de tot tipus d¿activitats de protecció dels valors mediambientals. Com es pot fer? En línia, Emplenant el formulari electrònic que hi ha disponible en l apartat Fes-ho ara! Presencialment: Presentant al Regi;;;;;S; ; ;;https://seu.badalona.cat/portalWeb/badalona.portal?_nfpb=true&_pageLabel=detall_tramit&dDocName=***003205#wlp_detall_tramit;18/06/2015;;;S;N;N;;Català 
***016019;Llicència per a la tinença de gossos de races presumptament perilloses;;;0021;sanitat;;N; ; ;;https://seu.badalona.cat/portalWeb/badalona.portal?_nfpb=true&_pageLabel=detall_tramit&dDocName=***016019#wlp_detall_tramit;23/05/2014;;;S;N;N;;Català 
***027187;Llicència d obres per obrir rases a la via pública;ualsevol persona física o jurídica, pública o privada, per ella mateixa o a través de representant.Com es pot fer?Oficina d¿Informació UrbanísticaImpresos modelCapDocumentació que cal aportarLlicència d¿obres menors: Normativa  En què consisteix el tràmit? La llicència d¿obres per a l¿obertura de rases suposa l¿autoritza;;0029;urbanisme;;N;Documentació que cal aportarLlicència d¿obres menors: ; ;;https://seu.badalona.cat/portalWeb/badalona.portal?_nfpb=true&_pageLabel=detall_tramit&dDocName=***027187#wlp_detall_tramit;23/05/2014;;;S;N;N;;Català 
***015842;Reserves d estacionament;om es pot fer? Serveis i tràmits En què consisteix el tràmit? La llicència de reserva d¿estacionament suposa l¿autorització de l¿ocupació de la via pública per  estacionar. Tipus de llicències: 1. Reserves d¿estacionament per a persones de mobilitat reduïda  : Reserves d¿estacionament que es conced;;0029;urbanisme;;N; ; ;;https://seu.badalona.cat/portalWeb/badalona.portal?_nfpb=true&_pageLabel=detall_tramit&dDocName=***015842#wlp_detall_tramit;29/06/2010;;;S;N;N;;Català 
***016014;Molèsties causades per a la presència d animals;;;0021;sanitat;;N; ; ;;https://seu.badalona.cat/portalWeb/badalona.portal?_nfpb=true&_pageLabel=detall_tramit&dDocName=***016014#wlp_detall_tramit;23/05/2014;;;S;N;N;;Català 
***016030;Presència de rosegadors  o insectes a la via pública;;;0021;sanitat;;N; ; ;;https://seu.badalona.cat/portalWeb/badalona.portal?_nfpb=true&_pageLabel=detall_tramit&dDocName=***016030#wlp_detall_tramit;23/05/2014;;;S;N;N;;Català 
***015844;Llicència per col.locar pilons a la Via Pública;Obtenció de la llicència per a la col·locació de pilons a la via publica. Qui ho pot demanar? Qualsevol   persona   física   o   jurídica,   pública   o   privada,   per   ella   mateixa   o   a   través   de  representant. Com es pot fer? Presencialment Oficina d¿Informació Urbanística Impresos model Cap Documentació que cal aportar ¿ Una còpia de la sol·licitud normalitzada. ¿ Fotografia ;;0029;urbanisme;;N;Documentació que cal aportar ¿ Una còpia de la sol·licitud normalitzada. ¿ Fotografia de l¿emplaçament on es vol col·locar el piló. ¿ Full d¿autoliquidació de taxes. ;Normativa  ¿ Llei 30/1992, de 26 de novembre, de Règim Jurídic de les Administracions Públiques i  del procediment administratiu comú. ¿ Lle 26/2010, de 3 d¿agost, de règim jurídic i de procediment de les administracions  públiques de Catalunya. ¿ Altra legislació i normativa vigent, segons l¿àmbit d¿aplicació. ¿ Ordenança fiscal núm. 14 relativa a la Taxa per llicències urbanístiques. ;;https://seu.badalona.cat/portalWeb/badalona.portal?_nfpb=true&_pageLabel=detall_tramit&dDocName=***015844#wlp_detall_tramit;21/06/2010;;;S;N;N;;Català 
***016028;Assessorament tècnic en control de plagues;;;0021;sanitat;;N; ; ;;https://seu.badalona.cat/portalWeb/badalona.portal?_nfpb=true&_pageLabel=detall_tramit&dDocName=***016028#wlp_detall_tramit;23/05/2014;;;S;N;N;;Català 
***016033;Molèsties per la presència de coloms o d¿altres aus urbanes;;;;;;N; ; ;;https://seu.badalona.cat/portalWeb/badalona.portal?_nfpb=true&_pageLabel=detall_tramit&dDocName=***016033#wlp_detall_tramit;23/05/2014;;;S;N;N;;Català 
***003086;Comunicació d incidències de medi ambient;Posar en coneixement de l¿ajuntament incidències que afectin els parcs, jardins i zones verdes,  les zones forestals, la platja o la mobilitat o altres qüestions relacionades amb la protecció del  medi ambient. Qui ho pot demanar? Qualsevol persona física o jurídica  Com es pot fer? Presencialment ¿ Àrea de Medi Ambient i Mobilitat ¿ Oficines Municipals de Districte (OMD) Impresos model Cap Documentació que cal aportar Imprès degudament complimentat Normativa Cap Preu Gratuït Organisme responsable Àrea de Medi Ambient i Mobi;;0016;medi ambient;;S;Documentació que cal aportar Imprès degudament complimentat ;Normativa Cap ;;https://seu.badalona.cat/portalWeb/badalona.portal?_nfpb=true&_pageLabel=detall_tramit&dDocName=***003086#wlp_detall_tramit;23/05/2014;;;S;N;N;;Català 
***016009;Assessorament sobre establiments alimentaris;Les   persones   interessades   a   fer   una   consulta   d¿una   activitat  relacionada  amb  el  comerç  minorista  d¿alimentac ió  o  amb  activitats  de  restauració   poden   sol·licitar   assessorament   tècnic   en   referència   als  requisits   legals   que   han   de   complir   aquests   establiments   en   relació  amb la normativa vigent. Aquest assessorament pot ser in situ al local o al Servei de Salut. Qui ho pot demanar? Qualsevol   persona   física   (en   aquest   cas   major   d¿edat)   o   jurídica   que  vulgui   assessorar-se   sobre   la   normativa   sanitària   que   ha   de   complir  una  activitat  de  comerç  minorista  d¿alimentació  o  de  restauració  en  el  municipi de Badalona. Com es pot fer? Pe;;0021;sanitat;;S; ;Normativa Llei 18/2009,  de 22 d¿octubre, de Salut Pública. ;;https://seu.badalona.cat/portalWeb/badalona.portal?_nfpb=true&_pageLabel=detall_tramit&dDocName=***016009#wlp_detall_tramit;14/01/2014;;;S;N;N;;Català 
***003088;Assessorament i informació sobre ús d energies renovables;Rebre informació i assessorament sobre l ús de les energies renovables. Qui ho pot demanar? Qualsevol persona física i/o jurídica Com es pot fer? Presencialment Cal   adreçar-se   al   departament   d Ecologia   Urbana   i   concertar,   prèviament,   data   i   hora.  Aquesta gestió es farà telefònicament. Documentació que cal aportar No es requereix documentació específica Normativa ¿ C;;0016;medi ambient;;S;Documentació que cal aportar No es requereix documentació específica ;Normativa ¿ Codi Tècnic de l¿Edificació (Reial Decret 314/2006, de 17 de març)  ¿ Reglament Instal·lacions Tèrmiques dels Edificis (Reial Decret 1027/2007, de 20 de  juliol)  ¿ Ordenança   Municipal   reguladora   de   la   incorporació   de   sistemes   de   captació  d¿energia solar per a usos tèrmics en les edificacions de Badalona (BOP 18/11/2003)  ;;https://seu.badalona.cat/portalWeb/badalona.portal?_nfpb=true&_pageLabel=detall_tramit&dDocName=***003088#wlp_detall_tramit;08/01/2015;;;S;N;N;;Català 
***078387;BC COMUNICACIÓ DE CENTRE DE CULTE;que consisteix el tràmit? Comunicació prèvia a l inici d¿activitats de centres de culte regulades per la Llei16/2009, del  22 de juliol, dels centres de culte i pel Decret 94/2010 que la desenvolupa, amb superfície  inferior   a   100   m²   i   aforament   inferior   a   90   persones, presentada   a   l¿Ajuntament,  acompanyada de la documentació legalment preceptiva, per la que es posa en coneixement  d¿aquest que es procedirà a iniciar l¿activitat, sota l¿exclusiva responsabilitat de les persones  titulars i tècniques, des de la data de la seva presentació, sense perjudici de les facultats de  comprovació, control i inspecció que tingui atribuïdes l¿Ajuntament.  Qui ho pot demanar? Qualsevol persona física o jurídica que vulgui iniciar qualsevol activitat de centre de culte  amb superfície de culte inferior a 100 m² i aforament inferior a 90 persones. Com es pot fer? Presencialment Impresos model - Instància de sol·licitud normalitzada. - Full d¿autoliquidació de taxes. - Ce;;0029;urbanisme;;N; ; ;;https://seu.badalona.cat/portalWeb/badalona.portal?_nfpb=true&_pageLabel=detall_tramit&dDocName=***078387#wlp_detall_tramit;24/03/2017;;;S;N;N;;Català 
***028186;Registre d Interessos;/Idctecreation_date>  <Idcteprimary_author>User</Idcteprimary_author>  <IdcteCreator>Writer</IdcteCreator>  <Idctepublisher>OpenOffice.org 3.1</Idctepublisher>   En què consisteix el tràmit? Declaracions per incorporar al Registre d¿activitats i al registre de béns patrimonials. Els   registres   municipals   d¿activitats   i   els   de   béns   patrimonials     integren   les   preceptives  declaracions  sobre  causes  de possible  incompatibilitat  i  activitats que  proporcionin    o  pugin  proporcionar ingressos econòmics d¿activitats i les de béns i drets patrimonials dels regidors i del  personal  directiu  local  amb els  formats  normalitzats  aprovats    en sessió  plenària    signades  electrònicament   juntament amb el secretari i  les certificacions dels registre especial d¿interessos  que es  puguin presentar. Qui ho pot demanar? Únicament els electes locals, i el p;;;;;N; ; ;;https://seu.badalona.cat/portalWeb/badalona.portal?_nfpb=true&_pageLabel=detall_tramit&dDocName=***028186#wlp_detall_tramit;23/05/2014;;;N;N;N;;Català 
***078345;Cita prèvia amb el Servei d¿Atenció al Ciutadà sobre COM TRAMITAR O CLASSIFICAR una activitat;om es pot fer?PreuPeríode de tramitacióTermini de resolucióÒrgan responsableInformació sobre les vostres dades personals En què consisteix el tràmit? Aquest tràmit consisteix en poder demanar una cita prèvia (dia/hora) per poder realitzar  consultes sobre com tramitar i presentar un expedient d¿activitats i informació d¿obres. Nota: Les consultes tècniques sobre legalitzacions d¿Acti;;0029;urbanisme;;S; ; ;;http://badalona.cat/appExtSC/citaprevia/solicitudPaso2!ccbs?idServicio=22&idAmbito=22&idDepartamento=22&idTramite=82&idAgenda=82;27/02/2017;;;S;N;N;;Català 
***016017;Cens Municipal d¿Animals de Companyia: registre d un animal. BAIXA;;;0021;sanitat;;N; ; ;;https://seu.badalona.cat/portalWeb/badalona.portal?_nfpb=true&_pageLabel=detall_tramit&dDocName=***016017#wlp_detall_tramit;23/05/2014;;;N;N;N;;Català 
***016024;Recollida d¿animals exòtics o altres vius del carrer;;;0021;sanitat;;N; ; ;;https://seu.badalona.cat/portalWeb/badalona.portal?_nfpb=true&_pageLabel=detall_tramit&dDocName=***016024#wlp_detall_tramit;23/05/2014;;;S;S;S;;Català 
***016006;Assessorament tècnic per a la instal¿lació d¿establiments de tatuatges, micropigmentació i pírcing;;;0021;sanitat;;N; ; ;;https://seu.badalona.cat/portalWeb/badalona.portal?_nfpb=true&_pageLabel=detall_tramit&dDocName=***016006#wlp_detall_tramit;26/10/2015;;;N;N;N;;Català 
***016013;Lesions causades per animals;;;0021;sanitat;;N; ; ;;https://seu.badalona.cat/portalWeb/badalona.portal?_nfpb=true&_pageLabel=detall_tramit&dDocName=***016013#wlp_detall_tramit;23/05/2014;;;S;N;N;;Català 
***078391;CS SUBROGACIÓ D UN EXPEDIENT EN TRÀMIT;PUS B/SUBROGACIÓ) En que consisteix el tràmit? Sol·licitud de canvi  del peticionari d¿una llicència o autorització durant la tramitació de la  mateixa   d¿acord  amb   el   que   preveu   l¿article   29   de  l Ordenança   Municipal   d¿Activitats  i  d¿Intervenció   Ambiental  presentada   a   l¿Ajuntament,   acompanyada   de   la   documentació  legalment preceptiva.  Qui ho pot demanar? Qualsevol   persona   física   o   jurídica   interessada   que   vulgui   subrogar-se   en   el   lloc  del  peticionari d¿una llicència o autorització durant la tramitació de la mateixa. Com es pot fer? Presencialment Impresos model: - Instància de sol·licitud normalitzada - Full d¿autoliquidaci;;0029;urbanisme;;N;Documentació que cal aportar - 2 còpies de la instància de sol·licitud normalitzada. - Fotocòpia compulsada del DNI, o títol identificatiu a Espanya, d¿ambdós sotasignats. - El resguard acreditatiu d¿haver efectuat el pagament de la taxa per la tramitació de  l¿expedient, d¿acord amb allò que disposi la corresponent Ordenança fiscal (model  normalitzat). ;Normativa - Llei 30/1992, de 26 de novembre, Règim Jurídic de les Administracions Públiques i  del Procediment Administratiu Comú. - Ordenança  Municipal   d¿Activitats   i   d¿Intervenció   Ambiental   de   l¿Ajuntament   de  Badalona (BOP 81, 4/4/2003). - Ordenança fiscal núm. 12. ;;https://seu.badalona.cat/portalWeb/badalona.portal?_nfpb=true&_pageLabel=detall_tramit&dDocName=***078391#wlp_detall_tramit;24/03/2017;;;S;N;N;;Català 
***078260;Inscripció a les activitats per la jornada ¿Mulla¿t¿ per l¿esclerosi múltiple;/Idctecreation_date>  <Idcteprimary_author>Planas Dueso, Eulalia</Idcteprimary_author>  <IdcteCreator>Writer</IdcteCreator>  <Idctepublisher>OpenOffice.org 3.1</Idctepublisher>   En que consisteix el tràmit? Inscripció a les activitats programades per l¿activitat solidària del ¿Mulla¿t¿ per l¿esclerosi  múltiple, que tindrà lloc el proper diumenge 10 de juliol de 2016 entre les 09.30 i 13.15  hores del matí, a la Piscina Municipal Mireia Belmonte de Badalona. Les  activitats  aquàtiques  programades  aniran  adreçades  a  famílies,  infants,  joves,  adults  i  gent  gran,  amb  la  finalitat  de  participar  en  aquesta  jornada  solidària  per  l¿esclerosi múltiple, mitjançant la pràctica esportiva aquàtica.  Les activitats programades per aquest dia seran les següents: aigua gim per a totes  les edats,  aigua gim familiar i jocs d¿aigua infantils i familiars. També hi haurà un espai  destinat a les persones que vulguin nedar lliurament i sumar metres per la jornada  solidària.  Totes les activitats programades tindran un màxim de places, per tant un cop inscrit a  l¿activitat, es confirmarà si s¿ha obtingut o no la plaça.  Quan  s¿hagin  exhaurit  les  places  d¿una  activitat,  és  podrà  continuar  gestionant  la  inscripció per formar part de la llista d¿espera. Si es gestiona alguna baixa, es notificarà  i adjudicarà per ordre d¿entrada a la persona que està a la llista d¿espera.     Qui ho pot demanar? Qualsevol persona física major d¿eda;;;;;N; ; ;;https://seu.badalona.cat/portalWeb/badalona.portal?_nfpb=true&_pageLabel=detall_tramit&dDocName=***078260#wlp_detall_tramit;02/06/2016;;;N;N;N;;Català 
***002813;Certificat d empadronament;Certificat emès per l¿Ajuntament de Badalona que acredita l¿empadronament  d¿una persona en un període concret (certificat de residència). Es pot fer constar també, si així es sol·licita, el nombre de persones les quals  conviuen o convivien en el mateix domicili amb la persona interessada durant  el període objecte del certificat (certificat de residència i convivència). Per tal que apareguin les dades de la resta de persones que conviuen o han  conviscut   amb   la   persona   que   fa   la   sol·licitud,   caldrà   una   autorització  d¿aquestes (s¿haurà d¿emplenar el model d¿autorització que apareix en aquest  tràmit). Les altres Administracions Públiques o Organismes Oficials, en exercici de  les   seves   competències,   poden   consultar   les   dades   del   padró   per   via  telemàtica  mitjançant  les  plataformes  existents  o,  en  tot  cas,  sol·licitar-les  directament a l¿Ajuntament. El   certificat,   a   diferència   del   volant,   és   l¿únic   document   que   acredita  fefaentment   la   residència   individual   o   col·lectiva   d¿un   ciutadà   i   per   tant  constitueix prova davant qualsevol procés administratiu o judicial. Per a la majoria de tràmits amb altres administracions (renovació de DNI,  passaport,   permís   de   conduir,   seguretat   social,   hisenda,   empreses  proveïdores  de   serveis   de  aigua,  electricitat,  gas,  telèfon,   alguns  tràmits  d¿estrangeria, etc.), és suficient amb la presentació d¿un volant. Qui ho pot demanar? La   persona   interessada   major   d¿edat,   o   persona   amb   autorització   de   la  persona interess;;0019;padró d habitants i Cens Electoral;;N; ; ;;https://seu.badalona.cat/portalWeb/badalona.portal?_nfpb=true&_pageLabel=detall_tramit&dDocName=***002813#wlp_detall_tramit;23/12/2016;;;S;N;N;;Català 
